{
  "kind": "governable_objects_registry",
  "version": "v1",
  "generated_by": "tools/gen/build_governable_objects_index.py",
  "objects": [
    {
      "id": "compliance.ai-act",
      "kind": "compliance_module",
      "name": "EU AI Act",
      "status": "active",
      "scope_targets": {
        "session_scope": "global-or-scoped"
      },
      "domain_targets": [
        "digital",
        "scientific"
      ],
      "family_targets": [],
      "specialization_targets": [],
      "attachment_modes": [
        "stack",
        "policy-composition"
      ],
      "source_ref": "compliance/ai-act/manifest.json",
      "manifest_ref": "compliance/ai-act/manifest.json",
      "compatibility_ref": "manifests/compatibility.matrix.json",
      "precedence_class": "compliance-layer",
      "runtime_consumable": true,
      "cli_discoverable": true,
      "experimental": false,
      "deprecated": false,
      "dependencies": [],
      "conflicts_with": [],
      "runtime_family_targets": [
        "core",
        "data"
      ],
      "runtime_binding_model": "global-baseline",
      "topology_target": "unified-runtime-v1",
      "execution_family_owner": "core",
      "knowledge_support_family": "none",
      "graph_family_owner": "none",
      "data_family_owner": "data"
    },
    {
      "id": "compliance.gdpr-eu",
      "kind": "compliance_module",
      "name": "GDPR EU",
      "status": "active",
      "scope_targets": {
        "session_scope": "global-or-scoped"
      },
      "domain_targets": [
        "digital",
        "scientific"
      ],
      "family_targets": [],
      "specialization_targets": [],
      "attachment_modes": [
        "stack",
        "policy-composition"
      ],
      "source_ref": "compliance/gdpr-eu/manifest.json",
      "manifest_ref": "compliance/gdpr-eu/manifest.json",
      "compatibility_ref": "manifests/compatibility.matrix.json",
      "precedence_class": "compliance-layer",
      "runtime_consumable": true,
      "cli_discoverable": true,
      "experimental": false,
      "deprecated": false,
      "dependencies": [],
      "conflicts_with": [],
      "runtime_family_targets": [
        "core",
        "data"
      ],
      "runtime_binding_model": "global-baseline",
      "topology_target": "unified-runtime-v1",
      "execution_family_owner": "core",
      "knowledge_support_family": "none",
      "graph_family_owner": "none",
      "data_family_owner": "data"
    },
    {
      "id": "compliance.retention-governance",
      "kind": "compliance_module",
      "name": "Retention Governance",
      "status": "active",
      "scope_targets": {
        "session_scope": "global-or-scoped"
      },
      "domain_targets": [],
      "family_targets": [],
      "specialization_targets": [],
      "attachment_modes": [
        "stack",
        "policy-composition"
      ],
      "source_ref": "compliance/retention-governance/manifest.json",
      "manifest_ref": "compliance/retention-governance/manifest.json",
      "compatibility_ref": "manifests/compatibility.matrix.json",
      "precedence_class": "compliance-layer",
      "runtime_consumable": true,
      "cli_discoverable": true,
      "experimental": false,
      "deprecated": false,
      "dependencies": [],
      "conflicts_with": [],
      "runtime_family_targets": [
        "core",
        "data"
      ],
      "runtime_binding_model": "global-baseline",
      "topology_target": "unified-runtime-v1",
      "execution_family_owner": "core",
      "knowledge_support_family": "none",
      "graph_family_owner": "none",
      "data_family_owner": "data"
    },
    {
      "id": "compliance.security-supply-chain",
      "kind": "compliance_module",
      "name": "Security Supply Chain",
      "status": "active",
      "scope_targets": {
        "session_scope": "global-or-scoped"
      },
      "domain_targets": [
        "digital",
        "operational",
        "scientific"
      ],
      "family_targets": [],
      "specialization_targets": [],
      "attachment_modes": [
        "stack",
        "policy-composition"
      ],
      "source_ref": "compliance/security-supply-chain/manifest.json",
      "manifest_ref": "compliance/security-supply-chain/manifest.json",
      "compatibility_ref": "manifests/compatibility.matrix.json",
      "precedence_class": "compliance-layer",
      "runtime_consumable": true,
      "cli_discoverable": true,
      "experimental": false,
      "deprecated": false,
      "dependencies": [],
      "conflicts_with": [],
      "runtime_family_targets": [
        "core",
        "data"
      ],
      "runtime_binding_model": "global-baseline",
      "topology_target": "unified-runtime-v1",
      "execution_family_owner": "core",
      "knowledge_support_family": "none",
      "graph_family_owner": "none",
      "data_family_owner": "data"
    },
    {
      "id": "customer.default.org-workspace-contextual-review",
      "kind": "customer_policy_pack",
      "name": "Organization and Workspace Contextual Review Pack",
      "status": "active",
      "scope_targets": {
        "organization_ids": [
          "default-org"
        ],
        "workspace_ids": [
          "ws_ops_review",
          "ws_science_review"
        ],
        "environment_classes": [
          "shared",
          "review"
        ],
        "session_scope": "workspace-bound"
      },
      "domain_targets": [
        "digital",
        "scientific"
      ],
      "family_targets": [
        "digital",
        "scientific"
      ],
      "specialization_targets": [
        "network-egress",
        "remote-publication",
        "parameter-governance",
        "result-publication-control"
      ],
      "attachment_modes": [
        "workspace-attach",
        "runtime-entrypoint"
      ],
      "source_ref": "manifests/customer-policy-packs/examples/customer.default.org-workspace-contextual-review.v1.json",
      "manifest_ref": "manifests/customer-policy-packs/examples/customer.default.org-workspace-contextual-review.v1.json",
      "compatibility_ref": "manifests/compatibility.matrix.json",
      "precedence_class": "specialization+contextual-overlays+customer-pack",
      "runtime_consumable": true,
      "cli_discoverable": true,
      "experimental": false,
      "deprecated": false,
      "dependencies": [
        "manifests/runtime.entrypoints.json#default-runtime"
      ],
      "conflicts_with": [],
      "runtime_family_targets": [
        "core",
        "exec",
        "data",
        "graph",
        "knowledge"
      ],
      "runtime_binding_model": "workspace-first",
      "topology_target": "unified-runtime-v1",
      "execution_family_owner": "exec",
      "knowledge_support_family": "knowledge",
      "graph_family_owner": "graph",
      "data_family_owner": "data"
    },
    {
      "id": "customer.ecohmedia.digital-outbound.gdpr-retention",
      "kind": "customer_policy_pack",
      "name": "EcohMedia Digital Outbound Regulatory Pack",
      "status": "active",
      "scope_targets": {
        "organization_ids": [
          "ecohmedia"
        ],
        "workspace_ids": [
          "ws_digital_outbound_prod",
          "ws_digital_outbound_stage"
        ],
        "environment_classes": [
          "production",
          "staging"
        ],
        "session_scope": "workspace-bound"
      },
      "domain_targets": [
        "digital"
      ],
      "family_targets": [
        "digital"
      ],
      "specialization_targets": [
        "network-egress",
        "remote-publication",
        "external-commentary",
        "artifact-distribution",
        "remote-retrieval",
        "digital-sink-control"
      ],
      "attachment_modes": [
        "workspace-attach",
        "runtime-entrypoint"
      ],
      "source_ref": "manifests/customer-policy-packs/examples/customer.ecohmedia.digital-outbound.gdpr-retention.v1.json",
      "manifest_ref": "manifests/customer-policy-packs/examples/customer.ecohmedia.digital-outbound.gdpr-retention.v1.json",
      "compatibility_ref": "manifests/compatibility.matrix.json",
      "precedence_class": "specialization+compliance+overlays+customer-pack",
      "runtime_consumable": true,
      "cli_discoverable": true,
      "experimental": false,
      "deprecated": false,
      "dependencies": [
        "manifests/runtime.entrypoints.json#default-runtime"
      ],
      "conflicts_with": [],
      "runtime_family_targets": [
        "core",
        "exec",
        "data",
        "graph",
        "knowledge"
      ],
      "runtime_binding_model": "workspace-first",
      "topology_target": "unified-runtime-v1",
      "execution_family_owner": "exec",
      "knowledge_support_family": "knowledge",
      "graph_family_owner": "graph",
      "data_family_owner": "data"
    },
    {
      "id": "enterprise.default.workspace.research-sandbox",
      "kind": "enterprise_custom_governance_object",
      "name": "Default Workspace Research Sandbox Governance",
      "status": "candidate",
      "review_state": "in_review",
      "scope_targets": {
        "organization_ids": [
          "default-org"
        ],
        "workspace_ids": [
          "ws_research_lab",
          "ws_science_review"
        ],
        "environment_classes": [
          "shared",
          "review"
        ],
        "session_scope": "workspace-bound"
      },
      "domain_targets": [
        "scientific",
        "digital"
      ],
      "family_targets": [
        "scientific",
        "digital"
      ],
      "specialization_targets": [
        "parameter-governance",
        "result-publication-control",
        "remote-publication"
      ],
      "attachment_modes": [
        "workspace_attach"
      ],
      "source_ref": "manifests/enterprise-custom-governance/examples/enterprise.default.workspace.research-sandbox.v1.json",
      "manifest_ref": "manifests/enterprise-custom-governance/examples/enterprise.default.workspace.research-sandbox.v1.json",